SERVICE INFORMATION,
Contract Type: $\quad$ Switching Service Provider $\quad \square$ Current Customer,
"Business Name (""Customer""): St Francis College","See Attached Addendum A For <br> Multiple Account Nos., and Service <br> and Billing Addresses"
Contact Name: Kevin O'Rourke <br> Email: korourke@sfc.edu <br> Primary Phone: (718) 489-5200 Secondary Phone: Fax: <br> Duns\#: 02-058-5600 Tax ID \#:,
"Tax Exemption: If a non-renewing customer, a completed tax exemption certificate must accompany this Agreement. If no certificate is attached, NextEra Energy Services will assume that sales to Customer are subject to Taxes and will process Customer's account accordingly.",
Initial Term: 36 Months,Start Month/Year: 2/2020
