Customer Name: 191 Presidential Condominium,,,
"Mailing Address: <br> 191 Presidential Boulevard <br> Bala Cynwyd, PA 19004 <br> United States",,Billing Address (if different):,
Contact Name: Steven Riela,,Phone: (610) 667-0700,
Fax:,,Email:,
Check Only if <br> Voluntary REC's <br> are requested,$\square$ Voluntary Renewable Energy <br> Product:NA,Check <br> Only if <br> Customer <br> is Tax <br> Exempt,"$\square$ If checked, tax exempt documentation must be <br> attached. Failure to attach will result in Customer <br> being charged tax until a completed form is on file <br> and accepted by the EDC. Customer will also be <br> responsible to arrange for any tax refunds directly <br> with the state taxing authority."
EDC/ElectricDistribution Company: <br> See Attachment A,,EDC Account Number(s) and approximate Start Date(s): See <br> Attachment A,
