Manage Your Account,
Pay Your Bill,Online Options (pplelectric.com)
Online: Visit pplelectric.com,Report an outage/check outage status
Phone: Call 1-800-342-5775,"Make a payment, view your bill and usage history."
Mall: Use envelope provided,Sign up for alerts.
"Card: MasterCard, Discover, Visa or debit, call 1-844-278-3310 (service fee applies)","- Enroll in paperless billing, automatic bill pay, budget billing. <br> - View your rate schedule at: pplelectric.com/rates"
"Correspondence: <br> Customer Services, 827 Hausman Road, Allentown, PA 18104-9392",
Other important information on the back of this bill $\rightarrow$,
