Customer Name: Guardian Drug Company,,,
Mailing Address: <br> 2 Charles Court South Brunswick Township <br> NJ <br> 08810,,"Billing Address (if different): 2 Charles Court <br> South Brunswick Township, NJ 08810 <br> United States",
Contact Name: Rajni Dakwala,,Phone: [646] 283-2745,
Fax:,,Email:,
Check Only <br> if Voluntary <br> REC's are <br> requested,$\square$ Voluntary Renewable Energy <br> Product: NA,Check Only if <br> Customer is <br> Tax Exempt,"$\square$ If checked, tax exempt <br> documentation will be attached"
LDC/LocalDistribution Company: See Attachment A,,LDC Account Number(s) and approximate <br> See Attachment A,Start Date(s):
